{
  "atlas_blocks": {
    "coverage_timeline": {
      "as_of": "2026-07-30T18:19:29.711360+00:00",
      "newsroom_total": 223,
      "overall_share": 35,
      "provenance": "data",
      "series": [
        {
          "ed_share": null,
          "month": "2023-03",
          "newsroom": 4,
          "universe": 0
        },
        {
          "ed_share": null,
          "month": "2023-04",
          "newsroom": 1,
          "universe": 0
        },
        {
          "ed_share": null,
          "month": "2023-05",
          "newsroom": 1,
          "universe": 0
        },
        {
          "ed_share": null,
          "month": "2023-06",
          "newsroom": 1,
          "universe": 0
        },
        {
          "ed_share": null,
          "month": "2023-07",
          "newsroom": 6,
          "universe": 0
        },
        {
          "ed_share": null,
          "month": "2023-08",
          "newsroom": 2,
          "universe": 0
        },
        {
          "ed_share": null,
          "month": "2023-09",
          "newsroom": 4,
          "universe": 0
        },
        {
          "ed_share": null,
          "month": "2023-10",
          "newsroom": 3,
          "universe": 0
        },
        {
          "ed_share": null,
          "month": "2023-11",
          "newsroom": 7,
          "universe": 0
        },
        {
          "ed_share": null,
          "month": "2023-12",
          "newsroom": 3,
          "universe": 0
        },
        {
          "ed_share": null,
          "month": "2024-01",
          "newsroom": 2,
          "universe": 0
        },
        {
          "ed_share": null,
          "month": "2024-02",
          "newsroom": 2,
          "universe": 0
        },
        {
          "ed_share": null,
          "month": "2024-03",
          "newsroom": 4,
          "universe": 0
        },
        {
          "ed_share": null,
          "month": "2024-04",
          "newsroom": 6,
          "universe": 0
        },
        {
          "ed_share": null,
          "month": "2024-05",
          "newsroom": 7,
          "universe": 0
        },
        {
          "ed_share": null,
          "month": "2024-06",
          "newsroom": 2,
          "universe": 0
        },
        {
          "ed_share": null,
          "month": "2024-07",
          "newsroom": 1,
          "universe": 0
        },
        {
          "ed_share": null,
          "month": "2024-08",
          "newsroom": 5,
          "universe": 0
        },
        {
          "ed_share": null,
          "month": "2024-09",
          "newsroom": 3,
          "universe": 0
        },
        {
          "ed_share": null,
          "month": "2024-10",
          "newsroom": 1,
          "universe": 0
        },
        {
          "ed_share": null,
          "month": "2024-11",
          "newsroom": 3,
          "universe": 0
        },
        {
          "ed_share": null,
          "month": "2024-12",
          "newsroom": 5,
          "universe": 0
        },
        {
          "ed_share": null,
          "month": "2025-01",
          "newsroom": 7,
          "universe": 0
        },
        {
          "ed_share": null,
          "month": "2025-02",
          "newsroom": 12,
          "universe": 0
        },
        {
          "ed_share": null,
          "month": "2025-03",
          "newsroom": 8,
          "universe": 0
        },
        {
          "ed_share": null,
          "month": "2025-04",
          "newsroom": 7,
          "universe": 0
        },
        {
          "ed_share": null,
          "month": "2025-05",
          "newsroom": 6,
          "universe": 0
        },
        {
          "ed_share": null,
          "month": "2025-06",
          "newsroom": 8,
          "universe": 0
        },
        {
          "ed_share": null,
          "month": "2025-07",
          "newsroom": 10,
          "universe": 0
        },
        {
          "ed_share": null,
          "month": "2025-08",
          "newsroom": 2,
          "universe": 0
        },
        {
          "ed_share": null,
          "month": "2025-09",
          "newsroom": 12,
          "universe": 0
        },
        {
          "ed_share": null,
          "month": "2025-10",
          "newsroom": 3,
          "universe": 0
        },
        {
          "ed_share": null,
          "month": "2025-11",
          "newsroom": 6,
          "universe": 0
        },
        {
          "ed_share": null,
          "month": "2025-12",
          "newsroom": 9,
          "universe": 0
        },
        {
          "ed_share": null,
          "month": "2026-01",
          "newsroom": 6,
          "universe": 0
        },
        {
          "ed_share": 15,
          "month": "2026-02",
          "newsroom": 3,
          "universe": 17
        },
        {
          "ed_share": 9,
          "month": "2026-03",
          "newsroom": 9,
          "universe": 93
        },
        {
          "ed_share": 17,
          "month": "2026-04",
          "newsroom": 18,
          "universe": 90
        },
        {
          "ed_share": 9,
          "month": "2026-05",
          "newsroom": 6,
          "universe": 64
        },
        {
          "ed_share": 12,
          "month": "2026-06",
          "newsroom": 8,
          "universe": 56
        },
        {
          "ed_share": 9,
          "month": "2026-07",
          "newsroom": 10,
          "universe": 97
        }
      ],
      "total_universe": 640,
      "universe_total": 417
    },
    "entity_graph": {
      "as_of": "2026-07-30T18:19:29.499135+00:00",
      "edges": [
        {
          "attested": false,
          "attested_at": null,
          "attested_by": null,
          "confidence": 0.0,
          "curation_status": "observed",
          "description": "Mentioned in this territory's explainer.",
          "description_source": "autolink",
          "dir": "out",
          "direction": "out",
          "ended_at": null,
          "evidence_excerpt": null,
          "from": "mainnet",
          "observed_at": null,
          "phrase": "ledger",
          "relation_type": null,
          "role": null,
          "source": "autolink",
          "tier": "mentioned",
          "to": "ledger",
          "verification_kind": null,
          "verified": false,
          "verified_at": null,
          "verified_by": null,
          "weight": 10
        },
        {
          "attested": false,
          "attested_at": null,
          "attested_by": null,
          "confidence": 0.0,
          "curation_status": "observed",
          "description": "Mentioned in this territory's explainer.",
          "description_source": "autolink",
          "dir": "out",
          "direction": "out",
          "ended_at": null,
          "evidence_excerpt": null,
          "from": "mainnet",
          "observed_at": null,
          "phrase": "technology",
          "relation_type": null,
          "role": null,
          "source": "autolink",
          "tier": "mentioned",
          "to": "technology",
          "verification_kind": null,
          "verified": false,
          "verified_at": null,
          "verified_by": null,
          "weight": 10
        }
      ],
      "intra_edges": [],
      "nodes": [
        {
          "center": true,
          "name": "Mainnet",
          "slug": "mainnet",
          "source": "topic",
          "tier": "center"
        },
        {
          "center": false,
          "confidence": 0.0,
          "is_stub": false,
          "name": "Ledger",
          "observed_at": null,
          "slug": "ledger",
          "source": "autolink",
          "tier": "mentioned",
          "verified": false,
          "verified_at": null,
          "weight": 10
        },
        {
          "center": false,
          "confidence": 0.0,
          "is_stub": false,
          "name": "Technology",
          "observed_at": null,
          "slug": "technology",
          "source": "autolink",
          "tier": "mentioned",
          "verified": false,
          "verified_at": null,
          "weight": 10
        }
      ],
      "provenance": "data",
      "second_ring": [],
      "total_routes": 2,
      "visible_routes": 2
    },
    "event_timeline": {
      "as_of": "2026-06-26T00:20:29.471474+00:00",
      "events": [
        {
          "date": "2024-04",
          "kind": "launch",
          "label": "EigenLayer + EigenDA live on Ethereum mainnet",
          "source": "https://ethereum.org"
        },
        {
          "date": "2024-04",
          "kind": "launch",
          "label": "OKX X Layer ZK rollup mainnet launch",
          "source": "https://ethereum.org/layer-2/learn/"
        },
        {
          "date": "2024-09",
          "kind": "launch",
          "label": "Fractal Bitcoin scaling mainnet goes live",
          "source": "https://www.hiro.so/blog/devnet-vs-testnet-vs-mainnet-what-do-they-mean-for-web3-developers"
        },
        {
          "date": "2024-12",
          "kind": "launch",
          "label": "Sonic mainnet launch",
          "source": "https://coinmarketcap.com/academy/glossary/mainnet"
        },
        {
          "date": "2025-02",
          "kind": "milestone",
          "label": "Ethereum Pectra upgrade deploys to Holesky testnet",
          "source": "https://ethereum.org"
        },
        {
          "date": "2025-02",
          "kind": "launch",
          "label": "Unichain public mainnet goes live as Superchain L2",
          "source": "https://ethereum.org/layer-2/learn/"
        },
        {
          "date": "2025-05",
          "kind": "milestone",
          "label": "Ethereum Pectra upgrade activates on mainnet",
          "source": "https://ethereum.org"
        },
        {
          "date": "2025-05",
          "kind": "launch",
          "label": "YieldNest mainnet launch on May 14",
          "source": ""
        }
      ],
      "model": "claude-sonnet-4-6",
      "provenance": "sonnet"
    },